
		{
			"pregnancy_year": 1990,
			"pregnancy_result": "premature_birth_28-37",
			"gestational_age": 36,
			"preeclampsia": false,
			"after_birth_complications": ["O86.1","O86.4"],
			"assistance_and_operations": ["03"],
			"pregnancy_pathologies": ["O32.3"],
			"birth_pathologies": ["O64.3","O67.8"],
			"child_information": [
				{
					"is_alive": true,
					"weight": 3250,
					"abnormal_development": false,
					"neurological_disorders": false
				}
			]
		}